{
  "fixtures": [
    {
      "checks": [
        {
          "category": "schema",
          "errorCodes": [],
          "ok": true,
          "warningCodes": []
        },
        {
          "category": "ref-closure",
          "errorCodes": [],
          "ok": true,
          "warningCodes": []
        },
        {
          "category": "policy",
          "errorCodes": [],
          "ok": true,
          "warningCodes": []
        },
        {
          "category": "binding",
          "errorCodes": [],
          "ok": true,
          "warningCodes": []
        },
        {
          "category": "run-evidence",
          "errorCodes": [],
          "ok": true,
          "warningCodes": []
        },
        {
          "category": "security",
          "errorCodes": [],
          "ok": true,
          "warningCodes": []
        }
      ],
      "errors": [],
      "name": "local-analysis",
      "ok": true,
      "path": "fixtures/core/local-analysis",
      "summary": {
        "artifacts": 7,
        "assembly": "assembly.local-analysis-001",
        "bindings": 7,
        "capability": "capability.run-analysis",
        "digestBinding": "binding.digest.run-summary",
        "policyDecision": "allowed_with_constraints",
        "run": "run-001",
        "runEvidence": "evidence.run-001"
      },
      "warnings": []
    },
    {
      "checks": [
        {
          "category": "schema",
          "errorCodes": [],
          "ok": true,
          "warningCodes": []
        },
        {
          "category": "ref-closure",
          "errorCodes": [],
          "ok": true,
          "warningCodes": []
        },
        {
          "category": "policy",
          "errorCodes": [],
          "ok": true,
          "warningCodes": []
        },
        {
          "category": "binding",
          "errorCodes": [],
          "ok": true,
          "warningCodes": []
        },
        {
          "category": "run-evidence",
          "errorCodes": [],
          "ok": true,
          "warningCodes": []
        },
        {
          "category": "security",
          "errorCodes": [],
          "ok": true,
          "warningCodes": []
        }
      ],
      "errors": [],
      "name": "build-test",
      "ok": true,
      "path": "fixtures/core/build-test",
      "summary": {
        "artifacts": 5,
        "assembly": "assembly.build-test-001",
        "bindings": 8,
        "capability": "capability.run-build-test",
        "digestBinding": "binding.digest.test-report",
        "policyDecision": "allowed_with_constraints",
        "run": "run-build-test-001",
        "runEvidence": "evidence.build-test-001"
      },
      "warnings": []
    },
    {
      "checks": [
        {
          "category": "schema",
          "errorCodes": [],
          "ok": true,
          "warningCodes": []
        },
        {
          "category": "ref-closure",
          "errorCodes": [],
          "ok": true,
          "warningCodes": []
        },
        {
          "category": "policy",
          "errorCodes": [],
          "ok": true,
          "warningCodes": []
        },
        {
          "category": "binding",
          "errorCodes": [],
          "ok": true,
          "warningCodes": []
        },
        {
          "category": "run-evidence",
          "errorCodes": [],
          "ok": true,
          "warningCodes": []
        },
        {
          "category": "security",
          "errorCodes": [],
          "ok": true,
          "warningCodes": [
            "remote_unverifiable_surface"
          ]
        }
      ],
      "errors": [],
      "name": "remote-service-binding",
      "ok": true,
      "path": "fixtures/core/remote-service-binding",
      "summary": {
        "artifacts": 5,
        "assembly": "assembly.remote-service-001",
        "bindings": 8,
        "capability": "capability.call-remote-service",
        "digestBinding": "binding.digest.remote-summary",
        "policyDecision": "allowed_with_constraints",
        "run": "run-remote-service-001",
        "runEvidence": "evidence.remote-service-001"
      },
      "warnings": [
        {
          "code": "remote_unverifiable_surface",
          "message": "Remote service surfaces are recorded but not semantically verified by Core.",
          "path": "run-evidence.records.remoteLimitations"
        }
      ]
    }
  ],
  "negativeSuites": [
    {
      "cases": [
        {
          "actualErrorCodes": [
            "assembly_action_without_capability"
          ],
          "expectedErrorCodes": [
            "assembly_action_without_capability"
          ],
          "name": "assembly-action-without-capability.json",
          "ok": true
        },
        {
          "actualErrorCodes": [
            "capability_implies_authorization"
          ],
          "expectedErrorCodes": [
            "capability_implies_authorization"
          ],
          "name": "capability-implies-authorization.json",
          "ok": true
        },
        {
          "actualErrorCodes": [
            "digest_binding_collapses_evidence_layers"
          ],
          "expectedErrorCodes": [
            "digest_binding_collapses_evidence_layers"
          ],
          "name": "digest-binding-collapses-evidence.json",
          "ok": true
        },
        {
          "actualErrorCodes": [
            "digest_evidence_used_as_run_evidence"
          ],
          "expectedErrorCodes": [
            "digest_evidence_used_as_run_evidence"
          ],
          "name": "digest-evidence-as-run-evidence.json",
          "ok": true
        },
        {
          "actualErrorCodes": [
            "duplicate_object_id"
          ],
          "expectedErrorCodes": [
            "duplicate_object_id"
          ],
          "name": "duplicate-object-id.json",
          "ok": true
        },
        {
          "actualErrorCodes": [
            "artifact_integrity_state_missing"
          ],
          "expectedErrorCodes": [
            "artifact_integrity_state_missing"
          ],
          "name": "external-artifact-unverified-integrity.json",
          "ok": true
        },
        {
          "actualErrorCodes": [
            "external_standard_copied_inline"
          ],
          "expectedErrorCodes": [
            "external_standard_copied_inline"
          ],
          "name": "external-standard-copied-inline.json",
          "ok": true
        },
        {
          "actualErrorCodes": [
            "invalid_run_state"
          ],
          "expectedErrorCodes": [
            "invalid_run_state"
          ],
          "name": "invalid-run-state.json",
          "ok": true
        },
        {
          "actualErrorCodes": [
            "missing_policy_decision"
          ],
          "expectedErrorCodes": [
            "missing_policy_decision"
          ],
          "name": "missing-policy-decision.json",
          "ok": true
        },
        {
          "actualErrorCodes": [
            "policy_decision_missing_obligations"
          ],
          "expectedErrorCodes": [
            "policy_decision_missing_obligations"
          ],
          "name": "policy-decision-missing-obligations.json",
          "ok": true
        },
        {
          "actualErrorCodes": [
            "run_completed_without_output"
          ],
          "expectedErrorCodes": [
            "run_completed_without_output"
          ],
          "name": "run-completed-without-output.json",
          "ok": true
        },
        {
          "actualErrorCodes": [
            "run_evidence_overclaims_correctness"
          ],
          "expectedErrorCodes": [
            "run_evidence_overclaims_correctness"
          ],
          "name": "run-evidence-overclaims-correctness.json",
          "ok": true
        },
        {
          "actualErrorCodes": [
            "run_without_assembly_reference"
          ],
          "expectedErrorCodes": [
            "run_without_assembly_reference"
          ],
          "name": "run-without-assembly-reference.json",
          "ok": true
        },
        {
          "actualErrorCodes": [
            "runtime_binding_missing_image_reference"
          ],
          "expectedErrorCodes": [
            "runtime_binding_missing_image_reference"
          ],
          "name": "runtime-oci-missing-image-reference.json",
          "ok": true
        },
        {
          "actualErrorCodes": [
            "secret_value_in_core_record"
          ],
          "expectedErrorCodes": [
            "secret_value_in_core_record"
          ],
          "name": "secret-value-service-binding.json",
          "ok": true
        },
        {
          "actualErrorCodes": [
            "unanchored_reproducible_artifact"
          ],
          "expectedErrorCodes": [
            "unanchored_reproducible_artifact"
          ],
          "name": "unanchored-reproducible-artifact.json",
          "ok": true
        },
        {
          "actualErrorCodes": [
            "invalid_binding_type"
          ],
          "expectedErrorCodes": [
            "invalid_binding_type"
          ],
          "name": "unknown-binding-role.json",
          "ok": true
        },
        {
          "actualErrorCodes": [
            "unresolved_artifact_reference"
          ],
          "expectedErrorCodes": [
            "unresolved_artifact_reference"
          ],
          "name": "unresolved-artifact-reference.json",
          "ok": true
        }
      ],
      "name": "fixtures/core/negative",
      "ok": true,
      "problems": []
    }
  ],
  "ok": true,
  "schema": "cap.core.conformance_report.v1",
  "status": "stable-v1.0.0",
  "targetLevel": "L3",
  "unsupportedFeatures": [
    "workflow execution",
    "external policy evaluation",
    "secret retrieval",
    "remote service semantic verification",
    "cryptographic attestation verification"
  ],
  "validator": {
    "name": "cap_core.reference_validator",
    "version": "1.0.0"
  }
}
